{
  "snapshot_type": "aof-metrics-snapshot",
  "snapshot_format_version": 1,
  "organization_ref": ".aof/organization.json",
  "generated_at": "2026-06-14T04:56:16.989Z",
  "declared_metric_ids": [
    "runtime-regression-health",
    "contract-coverage",
    "release-risk",
    "allocation-review-load"
  ],
  "observed_metrics": [
    {
      "metric_key": "task-open-count",
      "name": "Open Task Count",
      "value": 2,
      "unit": "tasks",
      "source": ".aof/tasks/open",
      "mapped_declared_metric_id": null
    },
    {
      "metric_key": "task-throughput-total",
      "name": "Task Throughput Total",
      "value": 25,
      "unit": "tasks",
      "source": ".aof/tasks",
      "mapped_declared_metric_id": null
    },
    {
      "metric_key": "contract-coverage-ratio",
      "name": "Contract Coverage Ratio",
      "value": 1,
      "unit": "ratio",
      "source": ".aof/organization.json",
      "mapped_declared_metric_id": "contract-coverage"
    },
    {
      "metric_key": "unresolved-escalation-count",
      "name": "Unresolved Escalation Count",
      "value": 0,
      "unit": "decisions",
      "source": ".aof/decisions",
      "mapped_declared_metric_id": "release-risk"
    },
    {
      "metric_key": "decision-record-count",
      "name": "Decision Record Count",
      "value": 3,
      "unit": "decisions",
      "source": ".aof/decisions",
      "mapped_declared_metric_id": null
    },
    {
      "metric_key": "allocation-plan-count",
      "name": "Allocation Plan Count",
      "value": 1,
      "unit": "artifacts",
      "source": ".aof/artifacts/allocation/plans",
      "mapped_declared_metric_id": null
    },
    {
      "metric_key": "policy-evaluation-count",
      "name": "Policy Evaluation Count",
      "value": 1,
      "unit": "artifacts",
      "source": ".aof/artifacts/allocation/policy-evaluations",
      "mapped_declared_metric_id": null
    },
    {
      "metric_key": "resource-claim-count",
      "name": "Resource Claim Count",
      "value": 1,
      "unit": "artifacts",
      "source": ".aof/artifacts/allocation/resource-claims",
      "mapped_declared_metric_id": null
    },
    {
      "metric_key": "approval-required-allocation-count",
      "name": "Approval-Required Allocation Count",
      "value": 1,
      "unit": "allocations",
      "source": ".aof/artifacts/allocation/plans",
      "mapped_declared_metric_id": "release-risk"
    },
    {
      "metric_key": "allocation-review-load",
      "name": "Allocation Review Load",
      "value": 0,
      "unit": "reviews",
      "source": ".aof/artifacts/allocation",
      "mapped_declared_metric_id": "allocation-review-load"
    },
    {
      "metric_key": "open-resource-claim-count",
      "name": "Open Resource Claim Count",
      "value": 0,
      "unit": "claims",
      "source": ".aof/artifacts/allocation/resource-claims",
      "mapped_declared_metric_id": null
    }
  ]
}
